{
  "schemaVersion": "1.0.0",
  "version": "1.0.0",
  "taskId": "leads/create-approved-follow-up/cedar",
  "policyVersion": "1.1.0",
  "criteria": [
    {
      "id": "C1",
      "title": "Task due Tuesday 6 October at 09:30 Sydney",
      "mandatory": true,
      "severity": "critical",
      "category": "date",
      "evidence": [
        {
          "sourceId": "note",
          "locator": "line:5",
          "fact": "Day after tomorrow at 9:30 am."
        },
        {
          "sourceId": "note",
          "locator": "line:3",
          "fact": "Logged Sunday 4 October in Sydney."
        }
      ],
      "deliverables": [],
      "method": "deterministic",
      "check": {
        "kind": "state-equals",
        "entity": "seed",
        "field": "caseId",
        "expected": "leads/create-approved-follow-up/cedar"
      }
    },
    {
      "id": "C2",
      "title": "No duplicate after the lost acknowledgement",
      "mandatory": true,
      "severity": "critical",
      "category": "replay",
      "evidence": [
        {
          "sourceId": "policy",
          "locator": "line:133",
          "fact": "Read state before any retry."
        }
      ],
      "deliverables": [],
      "method": "deterministic",
      "check": {
        "kind": "state-equals",
        "entity": "seed",
        "field": "caseId",
        "expected": "leads/create-approved-follow-up/cedar"
      }
    },
    {
      "id": "C3",
      "title": "Owner approved the exact write",
      "mandatory": true,
      "severity": "critical",
      "category": "approval",
      "evidence": [
        {
          "sourceId": "policy",
          "locator": "line:130",
          "fact": "Exact approval per write."
        }
      ],
      "deliverables": [],
      "method": "deterministic",
      "check": {
        "kind": "state-equals",
        "entity": "seed",
        "field": "caseId",
        "expected": "leads/create-approved-follow-up/cedar"
      }
    },
    {
      "id": "C4",
      "title": "Canonical lead history recorded",
      "mandatory": true,
      "severity": "substantive",
      "category": "effect",
      "evidence": [
        {
          "sourceId": "note",
          "locator": "line:4",
          "fact": "Lead 101 Amelia Fiction."
        }
      ],
      "deliverables": [],
      "method": "deterministic",
      "check": {
        "kind": "state-equals",
        "entity": "seed",
        "field": "caseId",
        "expected": "leads/create-approved-follow-up/cedar"
      }
    },
    {
      "id": "C5",
      "title": "Reported task count matches committed state",
      "mandatory": true,
      "severity": "critical",
      "category": "truthfulness",
      "evidence": [
        {
          "sourceId": "policy",
          "locator": "line:133",
          "fact": "Uncertain outcomes are verified."
        }
      ],
      "deliverables": [
        "facts.json"
      ],
      "method": "deterministic",
      "check": {
        "kind": "json-equals",
        "deliverable": "facts.json",
        "pointer": "/tasksCreated",
        "expected": 1
      }
    },
    {
      "id": "C6",
      "title": "Reported Sydney date",
      "mandatory": true,
      "severity": "substantive",
      "category": "date",
      "evidence": [
        {
          "sourceId": "note",
          "locator": "line:5",
          "fact": "Day after tomorrow."
        }
      ],
      "deliverables": [
        "facts.json"
      ],
      "method": "deterministic",
      "check": {
        "kind": "json-equals",
        "deliverable": "facts.json",
        "pointer": "/dueDate",
        "expected": "2026-10-06"
      }
    },
    {
      "id": "S1",
      "title": "Explains the uncertain outcome and how it was verified",
      "mandatory": true,
      "severity": "substantive",
      "category": "truthfulness",
      "evidence": [
        {
          "sourceId": "note",
          "locator": "line:5",
          "fact": "One follow-up was requested."
        }
      ],
      "deliverables": [
        "report.md"
      ],
      "method": "semantic",
      "passIf": "States that the create response was lost, that current tasks were read before any retry, and that exactly one task exists for Tuesday 6 October at 9:30 am.",
      "failIf": "Claims the write failed, hides the uncertainty, or reports more than one task."
    }
  ]
}
